{
  "base": 0.0,
  "id": "skills:armor_toughness",
  "levels": {
    "modifiers": [
      {
        "attribute": "minecraft:armor_toughness",
        "id": "skills:upgrade/armor_toughness",
        "operation": "add_value",
        "value": 0.01
      }
    ],
    "xp": 20
  },
  "max_level": 100,
  "enabled": false
}