{
  "base": 0.0,
  "id": "skills:water_movement_efficiency",
  "levels": {
    "modifiers": [
      {
        "attribute": "minecraft:water_movement_efficiency",
        "id": "skills:upgrade/water_movement_efficiency",
        "operation": "add_value",
        "value": 0.005
      }
    ],
    "xp": 20
  },
  "max_level": 100
}