{
  "base": 0.0,
  "id": "skills:movement_efficiency",
  "levels": {
    "modifiers": [
      {
        "attribute": "minecraft:movement_efficiency",
        "id": "skills:upgrade/movement_efficiency",
        "operation": "add_value",
        "value": 0.01
      }
    ],
    "xp": 20
  },
  "max_level": 100
}